<?xml version="1.0" encoding="UTF-8"?>
<!-- Documento: reservas_enu.xsd-->
<xs:schema xmlns:xs="http://www.w3.org/2001/XMLSchema">
  <xs:element name="reservas">
    <xs:complexType>
      <xs:choice maxOccurs="unbounded">
        <xs:element ref="reserva"/>
        <xs:element ref="cliente"/>
      </xs:choice>
    </xs:complexType>
    
  </xs:element>
  <xs:element name="reserva">
    <xs:complexType>
      <xs:sequence>
        <xs:element ref="fecha"/>
        <xs:element name="evento" type="xs:string"/>
      </xs:sequence>
      <xs:attribute name="cliente" type="xs:string" use="required"/>
      <xs:attribute name="local" type="xs:string" use="required"/>
    </xs:complexType>
  </xs:element>
  <xs:element name="cliente">
    <xs:complexType>
      <xs:sequence>
        <xs:element name="dni" type="xs:string"/>
        <xs:element name="nombreCliente" type="xs:string"/>
      </xs:sequence>
      <xs:attribute name="codCliente" type="xs:string" use="required"/>
    </xs:complexType>
  </xs:element>
<xs:element name="fecha">
<xs:complexType>
<xs:attribute name="mes" type="xs:string"/>
<xs:attribute name="dia" type="xs:string"/>
<xs:attribute name="horario" type="xs:string"/>
</xs:complexType>
</xs:element>
  
  

</xs:schema>
